source,target,context,tags,eng_start,eng_end,jpn_start,jpn_end
"Wow, this mech suit is amazing. Imagine if we put the jelly legs on. It would never have worked. You guys helped build a perfect mech.",このメカスーツはすごいね。ゼリーの足をつけてたら、絶対うまくいかなかったよ。みんなのおかげで完璧なメカができたね。,Time: 0:08:08.080000,,0:08:08.080000,0:08:15.861000,0:08:08.080000,0:08:15.861000
"Another super job, kids. What would the city do without us? Well done.",みんな、本当に良くやった！街を助けたね,Time: 0:08:16.783000,,0:08:16.783000,0:08:20.475000,0:08:16.783000,0:08:20.475000
Now it's time to power down,これからはリラックスする時間だよ,Time: 0:08:21.407000,,0:08:21.407000,0:08:23.728000,0:08:21.407000,0:08:23.728000
"For our first cool it exercise, we're going to sit down, squeeze our legs, and then rock forwards and backwards, just like this.",最初のクールダウンのエクササイズでは、座って足をぎゅっと閉じて、こんな風に前後にゆらゆら揺れよう。,Time: 0:08:28.455000,,0:08:28.455000,0:08:35.809000,0:08:28.455000,0:08:35.809000
"All right, ready kids? Let's go. Squeeze your legs. That's it.",準備はいい？足をぎゅっと閉じて。いいね。,Time: 0:08:36.732000,,0:08:36.732000,0:08:40.383000,0:08:36.732000,0:08:40.383000
And then rocking forwards and backwards.,前後にゆらゆら、揺れるよ。,Time: 0:08:40.981000,,0:08:40.981000,0:08:43.592000,0:08:40.981000,0:08:43.592000
You can even close your eyes during this.,目を閉じながらしても大丈夫だよ。,Time: 0:08:45.418000,,0:08:45.418000,0:08:47.721000,0:08:45.418000,0:08:47.721000
Nice and calming.,いい感じだね,Time: 0:08:47.721000,,0:08:47.721000,0:08:48.882000,0:08:47.721000,0:08:48.882000
You can also focus on your breath,前後にゆらゆら揺れながら,Time: 0:08:52.585000,,0:08:52.585000,0:08:54.087000,0:08:52.585000,0:08:54.087000
as you rock forwards,呼吸にも意識を,Time: 0:08:55.076000,,0:08:55.076000,0:08:56.885000,0:08:55.076000,0:08:56.885000
and backwards.,向けてみよう,Time: 0:08:57.244000,,0:08:57.244000,0:08:58.250000,0:08:57.244000,0:08:58.250000
Just make sure you don't go too wild.,倒れないように気をつけてね。,Time: 0:09:02.414000,,0:09:02.414000,0:09:04.684000,0:09:02.414000,0:09:04.684000
"That's it, everyone.",いい調子,Time: 0:09:08.575000,,0:09:08.575000,0:09:10.120000,0:09:08.575000,0:09:10.120000
Keep going.,頑張ってね,Time: 0:09:12.175000,,0:09:12.175000,0:09:13.233000,0:09:12.175000,0:09:13.233000
"Nice and slow, pushing off your feet.",ゆっくり足で押しながらね,Time: 0:09:14.121000,,0:09:14.121000,0:09:16.373000,0:09:14.121000,0:09:16.373000
One more here.,あと一回だよ,Time: 0:09:21.356000,,0:09:21.356000,0:09:23.145000,0:09:21.356000,0:09:23.145000
"Excellent. Now this is a perfect tool to use when you're feeling worried or even frustrated. Great job, kids.",このエクササイズを、ストレスを感じたときやむねがいっぱいになったときにしてみてね。,Time: 0:09:24.411000,,0:09:24.411000,0:09:31.800000,0:09:24.411000,0:09:31.800000
"For our final cool it exercise, we're going to do what's called a balloon breath. To do this, we're going to trace a balloon with our finger",最後のクールダウンのエクササイズでは、バルーン呼吸をしていくよ。指で風船の形をかいてみよう。,Time: 0:09:32.346000,,0:09:32.346000,0:09:39.223000,0:09:32.346000,0:09:39.223000
and breathe in.,息を吸って、,Time: 0:09:40.861000,,0:09:40.861000,0:09:42.770000,0:09:40.861000,0:09:42.770000
"Then when we get to the bottom, hold your breath.",下までいったら、息を止めて、,Time: 0:09:43.916000,,0:09:43.916000,0:09:46.532000,0:09:43.916000,0:09:46.532000
"Then as we breathe out, trace the string.",息を吐きながら、風船のひもを書いてみよう。,Time: 0:09:47.909000,,0:09:47.909000,0:09:51.295000,0:09:47.909000,0:09:51.295000
"Okay, ready kids? Breathing in through your nose. Here we go. Trace that balloon",準備はいい？鼻から息を吸って、風船を書いて,Time: 0:09:53.336000,,0:09:53.336000,0:09:58.421000,0:09:53.336000,0:09:58.421000
"Hold your breath,",キープして、,Time: 0:10:03.216000,,0:10:03.216000,0:10:04.290000,0:10:03.216000,0:10:04.290000
and breathe out. Trace the string.,息をはいて、ひもをかくよ,Time: 0:10:05.298000,,0:10:05.298000,0:10:07.940000,0:10:05.298000,0:10:07.940000
"That's it, let's do it again. Here we go.",いい調子だよ！,Time: 0:10:10.401000,,0:10:10.401000,0:10:12.150000,0:10:10.401000,0:10:12.150000
"Breathing in, allow your belly to expand.",息を吸うとき、お腹をふくらませよう。,Time: 0:10:12.150000,,0:10:12.150000,0:10:14.815000,0:10:12.150000,0:10:14.815000
Hold your breath,とめて、,Time: 0:10:19.801000,,0:10:19.801000,0:10:21.783000,0:10:19.801000,0:10:21.783000
and breathing out. Relax your belly.,お腹の力を抜いて、はこう。,Time: 0:10:21.783000,,0:10:21.783000,0:10:23.984000,0:10:21.783000,0:10:23.984000
"That's it, let's keep going. Deep breath in",いいね。最後だよ。深呼吸して。,Time: 0:10:27.414000,,0:10:27.414000,0:10:31.353000,0:10:27.414000,0:10:31.353000
hold your breath.,とめて、,Time: 0:10:34.650000,,0:10:34.650000,0:10:35.503000,0:10:34.650000,0:10:35.503000
and breathe it all out.,口から、はこう。,Time: 0:10:37.755000,,0:10:37.755000,0:10:40.218000,0:10:37.755000,0:10:40.218000
That feels amazing. I hope you feel as ready as I do for what's next.,すごいリラックスできたね！次のセッションが楽しみ！,Time: 0:10:43.489000,,0:10:43.489000,0:10:47.494000,0:10:43.489000,0:10:47.494000
We managed to build an awesome mech and save the city. We couldn't have done it without your help.,かっこいいメカを作って、街を助けることができたよ。みんな本当にすごかったよ！,Time: 0:10:48.677000,,0:10:48.677000,0:10:53.404000,0:10:48.677000,0:10:53.404000
See you soon.,またね！,Time: 0:10:53.728000,,0:10:53.728000,0:10:54.440000,0:10:53.728000,0:10:54.440000
Break it kids!,Break it kids!,Time: 0:10:54.854000,,0:10:54.854000,0:10:55.895000,0:10:54.854000,0:10:55.895000
Break it kids!,Break it kids!,Time: 0:10:57.397000,,0:10:57.397000,0:10:58.882000,0:10:57.397000,0:10:58.882000
